Test_ID,Single_Valid_All_Keys,Single_Latency,Multi_Valid_All_Keys,Multi_Latency,Single_Raw,Multi_L1_Raw,Multi_L2_Raw
Task_001,True,12.08,True,34.74,"{""TTP_ID"": ""T1021"", ""Explanation"": ""ICMP Ping. The attacker is using the ping command to scan the network for active hosts."", ""Severity"": ""Medium"", ""Mitigation"": ""Implement firewall rules to block outbound ICMP traffic.""}","{""TTP_ID"": ""None (Benign)"", ""Explanation"": ""Routine network diagnostics using an external DNS resolver.""}","{     ""Severity"": ""Low"",     ""Mitigation"": {         ""Description"": ""The identified activity is a routine network diagnostic task, which is benign in nature."",         ""Recommendation"": ""No mitigation action required. However, it's recommended to monitor the system for any future suspicious activities.""     } }"
Task_002,True,13.08,True,27.53,"{""TTP_ID"": ""T1569.321"", ""Explanation"": ""Chrome Process Hollowing via COM Interaction. The standard Chrome process is being injected into another legitimate process."", ""Severity"": ""High"", ""Mitigation"": ""Implement application control policies to restrict execution of processes, employ behavior-based monitoring.""}","{""TTP_ID"": ""None (Benign)"", ""Explanation"": ""Standard web browser execution by the user.""}","{ ""Severity"": ""Low"", ""Mitigation"": ""No action required. The identified process is a standard web browser execution by the user, which is a benign activity."" }"
Task_003,True,10.84,True,26.4,"{""TTP_ID"": ""None (Benign)"", ""Explanation"": ""Routine system process logon event. Highly benign."", ""Severity"": ""Low"", ""Mitigation"": ""No action required.""}","{""TTP_ID"": ""None (Benign)"", ""Explanation"": ""Routine system service logon event. Standard operation of the Windows Service.""}","{ ""Severity"": ""Low"", ""Mitigation"": ""No action required as this is a standard system service logon event."" }"
Task_004,True,12.96,True,49.03,"{""TTP_ID"": ""T1053.002"", ""Explanation"": ""A malicious payload was executed using the Windows Scripting Host (powershell.exe) with obfuscation."", ""Severity"": ""High"", ""Mitigation"": ""Block execution of scripts from untrusted sources, implement application control.""}","{""TTP_ID"": ""T1053.002"", ""Explanation"": ""A scheduled task executing a malicious payload, indicating an adversary is using the System Shutdown/Reboot binary event to execute a payload.""}","{   ""Severity"": ""High"",   ""Mitigation"": {     ""Immediate Action"": [       ""Disable and remove any suspicious scheduled tasks."",       ""Conduct a thorough review of system logs for any signs of unauthorized activity.""     ],     ""Long-term Mitigation"": [       ""Implement strict access controls on the Task Scheduler service."",       ""Regularly update and patch all systems to prevent exploitation of known vulnerabilities."",       ""Monitor system logs for any signs of suspicious activity and implement anomaly detection tools.""     ]   } }"
Task_005,True,13.69,True,55.4,"{""TTP_ID"": ""T1075"", ""Explanation"": ""The attacker is using ProcDump to monitor and dump the memory of an LSASS process for credential harvesting."", ""Severity"": ""High"", ""Mitigation"": ""Enable Control Panel Privilege Protection, apply least privilege principles. Consider deploying Application Guard.""}","{""TTP_ID"": ""T1087"", ""Explanation"": ""The adversary executed the Sysmon Procdump Extension. This technique involves using the native Windows System Monitor (procdump.exe) to dump memory dumps of target processes, bypassing application control mechanisms.""}","{   ""Severity"": ""High"",   ""Mitigation"": {     ""Immediate Action"": [       ""Block the execution of procdump.exe at the network perimeter using a firewall or intrusion prevention system."",       ""Implement Application Control (AppGuard, etc.) to prevent the execution of unknown binaries.""     ],     ""Long-term Mitigation"": [       ""Monitor for suspicious process creations and memory dumps using Sysmon and other monitoring tools."",       ""Implement a robust incident response plan to quickly contain and remediate potential threats."",       ""Consider implementing a sandboxing solution to isolate and analyze potentially malicious processes.""     ]   } }"
